Name,Scholar Link,DOI,Bibtex,PDF Name,Year,Scholar page,Journal,Downloaded,Downloaded from,Authors
Eksistensi Kinerja Reksadana Syariah Pada Era New Normal,https://journal.uir.ac.id/index.php/tabarru/article/view/7422,10.25299/jtb.2021.vol4(2).7422,True,Eksistensi Kinerja Reksadana Syariah Pada Era New Normal.pdf,2021,"https://scholar.google.com/scholar?hl=en&q=reksadana&as_vis=1&as_sdt=1,5&start=%d&as_ylo=2018",Jurnal Tabarru’: Islamic Banking and Finance,True,Scholar,"Rapini, Titi and Farida, Umi and Listyono Putro, Rizki"
Investasi Online Reksadana: Aspek Hukum dan Perlindungan Bagi Investor Selaku Konsumen,https://www.neliti.com/publications/521942/investasi-online-reksadana-aspek-hukum-dan-perlindungan-bagi-investor-selaku-kon,10.37541/plenojure.v10i1.561,True,,2021,"https://scholar.google.com/scholar?hl=en&q=reksadana&as_vis=1&as_sdt=1,5&start=%d&as_ylo=2018",PLENO JURE,False,,"Asriati, Asriati and Baddu, Sumiyati"
Penerapan Dan Perkembangan Reksadana Syariah,https://core.ac.uk/download/pdf/304914821.pdf,10.15575/aksy.v2i1.7862,True,Penerapan Dan Perkembangan Reksadana Syariah.pdf,2020,"https://scholar.google.com/scholar?hl=en&q=reksadana&as_vis=1&as_sdt=1,5&start=%d&as_ylo=2018",AKSY: Jurnal Ilmu Akuntansi dan Bisnis Syariah,True,Scholar,"Firmansyah, Leo"
Reksadana syariah dan konvensional di Indonesia,https://jurnal.polines.ac.id/index.php/keunis/article/view/2629,10.59833/altasyree.v15i01.1152,True,Reksadana syariah dan konvensional di Indonesia.pdf,2023,"https://scholar.google.com/scholar?hl=en&q=reksadana&as_vis=1&as_sdt=1,5&start=%d&as_ylo=2018","Al-Tasyree: Jurnal Bisnis, Keuangan dan Ekonomi Syariah",True,Scholar,"Lubis, Rusdi Hamka"
Analisis Kinerja Reksadana Pasar Uang Selama Pandemi Covid 19,https://jurnal.mdp.ac.id/index.php/msc/article/view/1721,,False,Analisis Kinerja Reksadana Pasar Uang Selama Pandemi Covid 19.pdf,2022,"https://scholar.google.com/scholar?hl=en&q=reksadana&as_vis=1&as_sdt=1,5&start=%d&as_ylo=2018",,True,Scholar,AG Putri;E Wijaya
Reksadana dalam Prespektif Syari'ah,https://www.academia.edu/download/68754532/10_Dimas_Royadi_Reksadana_Ok.pdf,,False,,2021,"https://scholar.google.com/scholar?hl=en&q=reksadana&as_vis=1&as_sdt=1,5&start=%d&as_ylo=2018",,False,,D Roynaldi
"… Nilai Tukar Rupiah (Kurs), Jakarta Islamic Index (JII), Usia Reksadana dan Volume Perdagangan Reksadana Terhadap Nilai Aktiva Bersih (Nab) Reksadana …",https://pustaka.untirta.ac.id/index.php/JTE/article/view/6325,10.35448/jte.v15i1.6325,True,__Nilai Tukar Rupiah _Kurs__ Jakarta Islamic Index _JII__ Usia Reksadana dan Volume Perdagangan Reksadana Terhadap Nilai Aktiva Bersih _Nab_ Reksadana__.pdf,2020,"https://scholar.google.com/scholar?hl=en&q=reksadana&as_vis=1&as_sdt=1,5&start=%d&as_ylo=2018",Tirtayasa Ekonomika,True,Scholar,"Chairani, Sarah"
Perbandingan Kinerja Reksadana Konvensional dengan Syariah,https://academicjournal.yarsi.ac.id/jeba/article/view/1242,10.47467/alkharaj.v5i1.1103,True,Perbandingan Kinerja Reksadana Konvensional dengan Syariah.pdf,2022,"https://scholar.google.com/scholar?hl=en&q=reksadana&as_vis=1&as_sdt=1,5&start=%d&as_ylo=2018","Al-Kharaj : Jurnal Ekonomi, Keuangan &amp; Bisnis Syariah",True,Scholar,"Caisar, Jefry and Andriana, Isni and Thamrin,  Kemas M. Husni"
Analisis kepuasan pengguna aplikasi bibit reksadana menggunakan metode eucs dan ipa,http://ojs.stmik-banjarbaru.ac.id/index.php/jutisi/article/view/655,10.61805/fahma.v21i3.7,True,Analisis kepuasan pengguna aplikasi bibit reksadana menggunakan metode eucs dan ipa.pdf,2023,"https://scholar.google.com/scholar?hl=en&q=reksadana&as_vis=1&as_sdt=1,5&start=%d&as_ylo=2018","Jurnal Informatika Komputer, Bisnis dan Manajemen",True,Scholar,"Winantu, Asih and Viony, Susepta Indah"
"Analisis Kinerja Reksadana Saham Syariah Dengan Metode Sharpe, Treynor, Jensen, M², dan TT",https://e-journal.uac.ac.id/index.php/iijse/article/view/194,10.25105/mrbm.v4i2.8116,True,Analisis Kinerja Reksadana Saham Syariah Dengan Metode Sharpe_ Treynor_ Jensen_ M²_ dan TT.pdf,2020,"https://scholar.google.com/scholar?hl=en&q=reksadana&as_vis=1&as_sdt=1,5&start=%d&as_ylo=2018",Media Riset Bisnis &amp; Manajemen,True,Scholar,"Usman, Bahtiar and Ratnasari, Indri"
Studi Komparatif Kinerja Reksadana Saham Konvensional dan Syariah Di Indonesia,http://download.garuda.kemdikbud.go.id/article.php?article=1542673&val=337&title=Studi%20Komparatif%20Kinerja%20Reksadana%20Saham%20Konvensional%20dan%20Syariah%20Di%20Indonesia,10.53990/dirham.v3i2.168,True,Studi Komparatif Kinerja Reksadana Saham Konvensional dan Syariah Di Indonesia.pdf,2022,"https://scholar.google.com/scholar?hl=en&q=reksadana&as_vis=1&as_sdt=1,5&start=%d&as_ylo=2018",DIRHAM : Jurnal Ekonomi Islam,True,Scholar,"Rifa’i, Ahmad and Siregar, Muhammad Rafi"
Investasi reksadana syariah di Indonesia islamic mutual fund investment in Indonesia,https://www.academia.edu/download/84276324/670.pdf,,False,,2020,"https://scholar.google.com/scholar?hl=en&q=reksadana&as_vis=1&as_sdt=1,5&start=%d&as_ylo=2018",,False,,F Andriani
Pengaruh Saham Dan Reksadana Syariah Terhadap Pertumbuhan Ekonomi Indonesia Tahun 2013-2019,https://garuda.kemdikbud.go.id/documents/detail/3510546,10.47134/jees.v1i2.135,True,,2024,"https://scholar.google.com/scholar?hl=en&q=reksadana&as_vis=1&as_sdt=1,5&start=%d&as_ylo=2018",Journal of Environmental Economics and Sustainability,False,,"Riady, Achmad and Arsidiq, Nur Usbianto"
"Analisis Jumlah Uang Beredar, Inflasi dan Nilai Aktiva Bersih Reksadana Syariah",http://jes.unisla.ac.id/index.php/jes/article/view/127,10.30736/jesa.v6i2.127,True,,2021,"https://scholar.google.com/scholar?hl=en&q=reksadana&as_vis=1&as_sdt=1,5&start=%d&as_ylo=2018",JES (Jurnal Ekonomi Syariah),False,,"Setiawan, Firman and Qudziyah, Qudziyah"
Pengaruh Inflasi dan Nilai tukar rupiah terhadap nilai aktiva bersih reksadana syariah,https://journal.unesa.ac.id/index.php/jei/article/view/26405,10.35313/jaief.v2i3.3034,True,Pengaruh Inflasi dan Nilai tukar rupiah terhadap nilai aktiva bersih reksadana syariah.pdf,2022,"https://scholar.google.com/scholar?hl=en&q=reksadana&as_vis=1&as_sdt=1,5&start=%d&as_ylo=2018",Journal of Applied Islamic Economics and Finance,True,Scholar,"Apriyanto, Mohammad and Setyowati, Diharpi Herli and Mayasari, Ine"
Reksa dana,http://www.bri-mi.co.id/media/80267/equity_rd_etf-indonesia-top-40_2023.pdf,,False,Reksa dana.pdf,2018,"https://scholar.google.com/scholar?hl=en&q=reksadana&as_vis=1&as_sdt=1,5&start=%d&as_ylo=2018",,True,Scholar,BE Indonesia
Pelatihan pengenalan investasi reksadana untuk pelajar SMK Ariya Metta,http://ejournal.atmajaya.ac.id/index.php/sabdamas/article/view/1003,,False,Pelatihan pengenalan investasi reksadana untuk pelajar SMK Ariya Metta.pdf,2019,"https://scholar.google.com/scholar?hl=en&q=reksadana&as_vis=1&as_sdt=1,5&start=%d&as_ylo=2018",,True,Scholar,
Mekanisme Reksadana Syariah Melalui Aplikasi Bibit Perspektif Akad Wakalah bil Ujrah,http://repo.unida.gontor.ac.id/id/eprint/2960,10.24235/jm.v7i2.10729,True,Mekanisme Reksadana Syariah Melalui Aplikasi Bibit Perspektif Akad Wakalah bil Ujrah.pdf,2022,"https://scholar.google.com/scholar?hl=en&q=reksadana&as_vis=1&as_sdt=1,5&start=%d&as_ylo=2018",Al-Mustashfa: Jurnal Penelitian Hukum Ekonomi Syariah,True,Scholar,"Firdaus, Muhammad Irkham"
Pengaruh Inflasi Dan Suku Bunga Terhadap Kinerja Reksadana Saham Konvensional Tahun 2018-2021,http://ema-jurnal.unmerpas.ac.id/index.php/ekonomi/article/view/111,10.47335/ema.v7i1.111,True,Pengaruh Inflasi Dan Suku Bunga Terhadap Kinerja Reksadana Saham Konvensional Tahun 2018-2021.pdf,2022,"https://scholar.google.com/scholar?hl=en&q=reksadana&as_vis=1&as_sdt=1,5&start=%d&as_ylo=2018",Jurnal EMA,True,Scholar,"Saputri, Novi Eka and Yudiantoro, Deny"
Analisis Kinerja Reksadana Pasar Uang Dan Faktor-Faktor Yang Mempengaruhinya,http://ojs.unikom.ac.id/index.php/jika/article/view/3221,10.31846/jae.v5i3.134,True,Analisis Kinerja Reksadana Pasar Uang Dan Faktor-Faktor Yang Mempengaruhinya.pdf,2018,"https://scholar.google.com/scholar?hl=en&q=reksadana&as_vis=1&as_sdt=1,5&start=%d&as_ylo=2018",Jurnal Apresiasi Ekonomi,True,Scholar,"Trianita, Mery and Yuhelmi, Yuhelmi"
Analisis Pengaruh Variabel Makro Ekonomi terhadap Nilai Aktiva Bersih Reksadana Saham Syariah Periode 2015-2019,https://jurnal.polban.ac.id/ojs-3.1.2/jaief/article/view/2468,10.24014/ekl.v4i1.12528,True,Analisis Pengaruh Variabel Makro Ekonomi terhadap Nilai Aktiva Bersih Reksadana Saham Syariah Periode 2015-2019.pdf,2021,"https://scholar.google.com/scholar?hl=en&q=reksadana&as_vis=1&as_sdt=1,5&start=%d&as_ylo=2018",Eklektik : Jurnal Pendidikan Ekonomi dan Kewirausahaan,True,Scholar,"Febriyani, Ainaya and Pratama, Abdul Aziz Nugraha and Ratno, Fernaldi Anggadha"
"Pengaruh inflasi, saham syariah, sukuk dan reksadana syariah terhadap pertumbuhan ekonomi nasional tahun 2013-2020",https://jurnal.unismuhpalu.ac.id/index.php/JSM/article/view/2435,10.47134/jees.v1i2.135,True,Pengaruh inflasi_ saham syariah_ sukuk dan reksadana syariah terhadap pertumbuhan ekonomi nasional tahun 2013-2020.pdf,2024,"https://scholar.google.com/scholar?hl=en&q=reksadana&as_vis=1&as_sdt=1,5&start=%d&as_ylo=2018",Journal of Environmental Economics and Sustainability,True,Scholar,"Riady, Achmad and Arsidiq, Nur Usbianto"
Wanprestasi manajer investasi terhadap investor reksadana,https://fhukum.unpatti.ac.id/jurnal/sasi/article/view/100,10.47268/sasi.v23i2.100,True,Wanprestasi manajer investasi terhadap investor reksadana.pdf,2018,"https://scholar.google.com/scholar?hl=en&q=reksadana&as_vis=1&as_sdt=1,5&start=%d&as_ylo=2018",SASI,True,Scholar,"Pariela, Marselo Valentino Geovani"
"Pengaruh Perceived Ease Of Use, Product Knowledge, Dan Trust Terhadap Minat Menggunakan Aplikasi Reksadana Bibit",https://ejournal.unhi.ac.id/index.php/widyaamrita/article/view/1404,,False,Pengaruh Perceived Ease Of Use_ Product Knowledge_ Dan Trust Terhadap Minat Menggunakan Aplikasi Reksadana Bibit.pdf,2021,"https://scholar.google.com/scholar?hl=en&q=reksadana&as_vis=1&as_sdt=1,5&start=%d&as_ylo=2018",,True,Scholar,IMI Gunawan;IW Suartina
Analisis Faktor-Fator yang Mempengaruhi Penggunaan Aplikasi Investasi Reksadana Online pada Generasi Millenial dan Generasi Z,https://www.syekhnurjati.ac.id/journal/index.php/itej/article/view/99,10.24235/itej.v7i1.99,True,Analisis Faktor-Fator yang Mempengaruhi Penggunaan Aplikasi Investasi Reksadana Online pada Generasi Millenial dan Generasi Z.pdf,2022,"https://scholar.google.com/scholar?hl=en&q=reksadana&as_vis=1&as_sdt=1,5&start=%d&as_ylo=2018",ITEJ (Information Technology Engineering Journals),True,Scholar,"Andrea, Jasmine Aubrey and Suroso, Jarot S"
"Pengaruh saham syariah, obligasi syariah, reksadana syariah dan inflasi terhadap pertumbuhan ekonomi indonesia periode 2011-2017",http://e-repository.perpus.uinsalatiga.ac.id/id/eprint/5281,10.35870/jemsi.v9i6.1718,True,,2023,"https://scholar.google.com/scholar?hl=en&q=reksadana&as_vis=1&as_sdt=1,5&start=%d&as_ylo=2018","JEMSI (Jurnal Ekonomi, Manajemen, dan Akuntansi)",False,,"Nurwita and Fajri, Ikhsan and Zuliani and Zulfan Yusuf and Yuni Ayu Safitri"
Investasi Reksadana Syariah Di Aplikasi Bibit,http://ejournal.radenintan.ac.id/index.php/asas/article/view/11284,10.24042/asas.v13i2.11284,True,,2022,"https://scholar.google.com/scholar?hl=en&q=reksadana&as_vis=1&as_sdt=1,5&start=%d&as_ylo=2018",ASAS,False,,"Karno, Rendi and Martinouva, Rissa Afni"
Determinan Kinerja Reksadana Saham Syariah,https://www.neliti.com/publications/315137/determinan-kinerja-reksadana-saham-syariah,10.61252/fjeb.v1i1.7,True,,2022,"https://scholar.google.com/scholar?hl=en&q=reksadana&as_vis=1&as_sdt=1,5&start=%d&as_ylo=2018",Faletehan Jurnal Ekonomi dan Bisnis,False,,"Nurhikmat, Mira and Desta, Fitri"
Investasi reksa dana sebagai alternatif investasi bagi investor pemula,http://jurnal.politeknik-kebumen.ac.id/E-Bis/article/view/242,10.37339/e-bis.v4i1.242,True,Investasi reksa dana sebagai alternatif investasi bagi investor pemula.pdf,2020,"https://scholar.google.com/scholar?hl=en&q=reksadana&as_vis=1&as_sdt=1,5&start=%d&as_ylo=2018",Jurnal E-Bis (Ekonomi-Bisnis),True,Scholar,"Adhianto, Deden"
"Pengaruh Ekspor, Reksadana Syariah dan Utang Luar Negeri Terhadap Pertumbuhan Ekonomi Nasional Periode 2012-2020",https://jurnal.stie-aas.ac.id/index.php/jei/article/view/4576,10.47467/alkharaj.v5i6.3711,True,Pengaruh Ekspor_ Reksadana Syariah dan Utang Luar Negeri Terhadap Pertumbuhan Ekonomi Nasional Periode 2012-2020.pdf,2023,"https://scholar.google.com/scholar?hl=en&q=reksadana&as_vis=1&as_sdt=1,5&start=%d&as_ylo=2018","Al-Kharaj : Jurnal Ekonomi, Keuangan &amp; Bisnis Syariah",True,Scholar,"Nur Arifianti, Shinta Oktia and Hidayati, Amalia Nuril"
Analisis kinerja reksadana konvensional dan reksadana syariah untuk keputusan investasi investor,https://journal.moestopo.ac.id/index.php/jakpi/article/view/1345,10.32509/jakpi.v1i1.1345,True,Analisis kinerja reksadana konvensional dan reksadana syariah untuk keputusan investasi investor.pdf,2021,"https://scholar.google.com/scholar?hl=en&q=reksadana&as_vis=1&as_sdt=1,5&start=%d&as_ylo=2018","Jurnal Akuntansi, Keuangan, Pajak dan Informasi (JAKPI)",True,Scholar,"Indriani, Riri and Budyastuti, Triyani"
Analisis Faktor-Faktor yang Memengaruhi Nilai Aktiva Bersih Reksadana Syariah (Periode 2016-2019),https://jurnal.polban.ac.id/ojs-3.1.2/jaief/article/view/2474,10.35313/jaief.v1i2.2474,True,Analisis Faktor-Faktor yang Memengaruhi Nilai Aktiva Bersih Reksadana Syariah _Periode 2016-2019_.pdf,2021,"https://scholar.google.com/scholar?hl=en&q=reksadana&as_vis=1&as_sdt=1,5&start=%d&as_ylo=2018",Journal of Applied Islamic Economics and Finance,True,Scholar,"Aldiansyah, Aldiansyah and Tripuspitorini, Fifi Afiyanti and Hadiani, Fatmi"
Determinan Makro Ekonomi Yang Mempengaruhi Nilai Aktiva Bersih Reksadana Syariah,https://jurnal.unigo.ac.id/index.php/gaj/article/view/1681,10.32662/gaj.v4i2.1681,True,Determinan Makro Ekonomi Yang Mempengaruhi Nilai Aktiva Bersih Reksadana Syariah.pdf,2021,"https://scholar.google.com/scholar?hl=en&q=reksadana&as_vis=1&as_sdt=1,5&start=%d&as_ylo=2018",Gorontalo Accounting Journal,True,Scholar,"Azzahra, Khoirunnisa and Arianti, Baiq Fitri"
Pengaruh Motivasi Investasi Dan Kemajuan Teknologi Terhadap Minat Berinvestasi Di Reksadana Syariah Pada Generasi Z Kota Surabaya,https://journal.unesa.ac.id/index.php/jei/article/view/17871,,False,Pengaruh Motivasi Investasi Dan Kemajuan Teknologi Terhadap Minat Berinvestasi Di Reksadana Syariah Pada Generasi Z Kota Surabaya.pdf,2022,"https://scholar.google.com/scholar?hl=en&q=reksadana&as_vis=1&as_sdt=1,5&start=%d&as_ylo=2018",,True,Scholar,N Ainiyah;R Indrarini
Pengaruh variabel makro terhadap nilai aktiva bersih (NAB) reksadana saham syariah,https://wahanaislamika.staisw.ac.id/index.php/WI/article/view/48,10.35313/jaief.v2i2.2973,True,Pengaruh variabel makro terhadap nilai aktiva bersih _NAB_ reksadana saham syariah.pdf,2022,"https://scholar.google.com/scholar?hl=en&q=reksadana&as_vis=1&as_sdt=1,5&start=%d&as_ylo=2018",Journal of Applied Islamic Economics and Finance,True,Scholar,"Sulsitiyowati, Indah and Tamara, Destian Arshad Darulmalshah and Barnas, Benny"
"Analisis kinerja reksadana saham syariah di pasar modal indonesia menggunakan Metode Sharpe, Treynor, dan Jensen Periode 2017-2018",https://journal.iainkudus.ac.id/index.php/syirkah/article/view/8408,10.22219/jaa.v1i1.6953,True,Analisis kinerja reksadana saham syariah di pasar modal indonesia menggunakan Metode Sharpe_ Treynor_ dan Jensen Periode 2017-2018.pdf,2018,"https://scholar.google.com/scholar?hl=en&q=reksadana&as_vis=1&as_sdt=1,5&start=%d&as_ylo=2018",Jurnal Akademi Akuntansi,True,Scholar,"Wardhani, Raudhah Trisna and Juanda, Ahmad and Syam, Dhaniel"
Analisis Komparatif Kinerja Reksadana Syariah Di Indonesia Sebelum dan Saat Pandemi Covid-19,https://e-journal.uingusdur.ac.id/jief/article/view/6243,10.28918/jief.v2i2.6243,True,Analisis Komparatif Kinerja Reksadana Syariah Di Indonesia Sebelum dan Saat Pandemi Covid-19.pdf,2022,"https://scholar.google.com/scholar?hl=en&q=reksadana&as_vis=1&as_sdt=1,5&start=%d&as_ylo=2018",JIEFâ€¯: Journal of Islamic Economics and Finance,True,Scholar,"Hapsari, Tri Dyah"
Kinerja Reksadana Saham di Situs Bareksa,https://jurnal.usahid.ac.id/index.php/accounting/article/view/99,10.36441/mae.v2i2.99,True,Kinerja Reksadana Saham di Situs Bareksa.pdf,2021,"https://scholar.google.com/scholar?hl=en&q=reksadana&as_vis=1&as_sdt=1,5&start=%d&as_ylo=2018",Management &amp; Accounting Expose,True,Scholar,"Simu, Nicodemus"
