Name,Scholar Link,DOI,Bibtex,PDF Name,Year,Scholar page,Journal,Downloaded,Downloaded from,Authors
"Pengaruh Edukasi Investasi, Persepsi Return dan Persepsi Risiko terhadap Minat Berinvestasi Saham Syariah",http://ejournal.iaimu.ac.id/index.php/freakonomics/article/download/32/30,10.36420/freakonomics.v1i1.25,True,,2020,"https://scholar.google.com/scholar?hl=en&q=investasi&as_vis=1&as_sdt=1,5&start=%d&as_ylo=2018",FreakonomicS: Journal of Islamic Economics and Finance,False,,"Setyowati, Sulis and Wulandari, Diyah and Hana, Kharis Fadlullah"
Hindari Investasi Bodong Dengan Literasi Finansial,https://scholar.archive.org/work/uraaq7cnunc5bnckqbkvhv4bzy/access/wayback/https://jurnalakrab.kemdikbud.go.id/index.php/jurnalakrab/article/download/190/156,10.51495/jurnalakrab.v9i2.190,True,Hindari Investasi Bodong Dengan Literasi Finansial.pdf,2018,"https://scholar.google.com/scholar?hl=en&q=investasi&as_vis=1&as_sdt=1,5&start=%d&as_ylo=2018",Jurnal AKRAB,True,Scholar,"Firdausi, Annas"
Faktor-Faktor Yang Mendorong Keputusan Investasi Saham Di Masa Pandemic,https://proceeding.isas.or.id/index.php/sentrinov/article/view/431,10.52434/jwe.v21i2.1925,True,Faktor-Faktor Yang Mendorong Keputusan Investasi Saham Di Masa Pandemic.pdf,2022,"https://scholar.google.com/scholar?hl=en&q=investasi&as_vis=1&as_sdt=1,5&start=%d&as_ylo=2018",Jurnal Wacana Ekonomi,True,Scholar,"Mulyana, Tatang and Cupiadi, Hedi and Azzahra, Alya Fattima"
Peningkatan Investasi Dan Hilirisasi Nikel Di Indonesia,https://ejournal.mandalanursa.org/index.php/JISIP/article/view/3085,10.60126/maras.v2i1.189,True,Peningkatan Investasi Dan Hilirisasi Nikel Di Indonesia.pdf,2024,"https://scholar.google.com/scholar?hl=en&q=investasi&as_vis=1&as_sdt=1,5&start=%d&as_ylo=2018",MARAS: Jurnal Penelitian Multidisiplin,True,Scholar,"Irawan, Irawan and Oha, Geni Ayu Rambu and Heri, Abdul and Fatma, Ipa and Muhammad, Adjie Suradji and Triputro, R. Widodo"
Implementasi Investasi Emas Syariah Perspektif Hukum Islam,https://www.researchgate.net/profile/Bagas-Heradhyaksa/publication/362387927_Jurnal_Hukum_Ekonomi_Islam_JHEI_Implementasi_Investasi_Emas_Syariah_Perspektif_Hukum_Islam_ABST_RAK/links/62e782df7782323cf19067c0/Jurnal-Hukum-Ekonomi-Islam-JHEI-Implementasi-Investasi-Emas-Syariah-Perspektif-Hukum-Islam-ABST-RAK.pdf,10.26618/j-hes.v5i02.5302,True,Implementasi Investasi Emas Syariah Perspektif Hukum Islam.pdf,2021,"https://scholar.google.com/scholar?hl=en&q=investasi&as_vis=1&as_sdt=1,5&start=%d&as_ylo=2018",Jurnal Hukum Ekonomi Syariah,True,Scholar,"Hafizd, Jefik Zulfikar"
Keputusan Investasi Dan Nilai Perusahaan,http://jurnaltsm.id/index.php/EJATSM/article/view/993,,False,Keputusan Investasi Dan Nilai Perusahaan.pdf,2021,"https://scholar.google.com/scholar?hl=en&q=investasi&as_vis=1&as_sdt=1,5&start=%d&as_ylo=2018",,True,Scholar,FS Mumpuni;DK Indrastuti
Standar perlindungan hukum kegiatan investasi pada bisnis jasa pariwisata di indonesia,https://core.ac.uk/download/pdf/268201100.pdf,,False,,2018,"https://scholar.google.com/scholar?hl=en&q=investasi&as_vis=1&as_sdt=1,5&start=%d&as_ylo=2018",,False,,L Julianti;RP Subekti
Klasifikasi Keputusan Investasi Di Masa Pandemi Covid-19 Dengan Menggunakan Naive Bayes,https://journal.yrpipku.com/index.php/msej/article/view/871,,False,Klasifikasi Keputusan Investasi Di Masa Pandemi Covid-19 Dengan Menggunakan Naive Bayes.pdf,2022,"https://scholar.google.com/scholar?hl=en&q=investasi&as_vis=1&as_sdt=1,5&start=%d&as_ylo=2018",,True,Scholar,M Rinestu;B Marsanto
Pengaruh investasi asing dan investasi dalam negeri terhadap perekonomian Indonesia,https://journal.maranatha.edu/index.php/jam/article/view/2282,10.30742/economie.v5i1.3433,True,,2023,"https://scholar.google.com/scholar?hl=en&q=investasi&as_vis=1&as_sdt=1,5&start=%d&as_ylo=2018",Economie: Jurnal Ilmu Ekonomi,False,,"Maranatha, Belly"
Pengaruh Literasi Keuangan Dan Perilaku Keuangan Terhadap Keputusan Investasi Mahasiswa,http://bussman.gapenas-publisher.org/index.php/home/article/view/39,10.22219/jofei.v3i3.28645,True,Pengaruh Literasi Keuangan Dan Perilaku Keuangan Terhadap Keputusan Investasi Mahasiswa.pdf,2023,"https://scholar.google.com/scholar?hl=en&q=investasi&as_vis=1&as_sdt=1,5&start=%d&as_ylo=2018",Journal of Financial Economics &amp; Investment,True,Scholar,Muhammad Distian Andi Hermawan
Analisis Dampak Investasi Terhadap Perekonomian Daerah: Studi Kasus Investasi Pertambangan Mineral Logam Provinsi Papua,https://www.jurnal.perhapi.or.id/index.php/impj/article/view/18,10.36986/impj.v2i1.18,True,Analisis Dampak Investasi Terhadap Perekonomian Daerah_ Studi Kasus Investasi Pertambangan Mineral Logam Provinsi Papua.pdf,2020,"https://scholar.google.com/scholar?hl=en&q=investasi&as_vis=1&as_sdt=1,5&start=%d&as_ylo=2018",Indonesian Mining Professionals Journal,True,Scholar,"Rosyid, Fadhila Achmadi"
"Investasi hijau: mengintergrasikan faktor enviromental, social dan governance dalam keputusan investasi",http://penerbitgoodwood.com/index.php/Jakman/article/view/112,10.35912/jakman.v2i2.112,True,Investasi hijau_ mengintergrasikan faktor enviromental_ social dan governance dalam keputusan investasi.pdf,2021,"https://scholar.google.com/scholar?hl=en&q=investasi&as_vis=1&as_sdt=1,5&start=%d&as_ylo=2018","Jurnal Akuntansi, Keuangan, dan Manajemen",True,Scholar,"Adi Cakranegara, Pandu"
Analisis Faktor Yang Mempengaruhi Investasi Asing Langsung Di Indonesia Pada Tahun 1989-2019,https://transpublika.co.id/ojs/index.php/Transekonomika/article/view/102,10.29103/jeru.v2i2.1721,True,Analisis Faktor Yang Mempengaruhi Investasi Asing Langsung Di Indonesia Pada Tahun 1989-2019.pdf,2019,"https://scholar.google.com/scholar?hl=en&q=investasi&as_vis=1&as_sdt=1,5&start=%d&as_ylo=2018",Jurnal Ekonomi Regional Unimal,True,Scholar,"Jannah, Rauzatul and Asnawi, Asnawi"
"… atas Risiko terhadap Minat Investasi Mahasiswa di Pasar Modal: Kata Kunci: Sosialisasi Pasar Modal, Persepsi Atas Risiko, Minat Investasi Mahasiswa di Pasar …",http://114.7.153.31/index.php/jam/article/view/2044,,False,__atas Risiko terhadap Minat Investasi Mahasiswa di Pasar Modal_ Kata Kunci_ Sosialisasi Pasar Modal_ Persepsi Atas Risiko_ Minat Investasi Mahasiswa di Pasar__.pdf,2020,"https://scholar.google.com/scholar?hl=en&q=investasi&as_vis=1&as_sdt=1,5&start=%d&as_ylo=2018",,True,Scholar,DK Wardani
Analisis Risk dan Return Investasi pada Ethereum dan Saham LQ45,http://penerbitgoodwood.com/index.php/simo/article/view/669,10.35912/simo.v2i2.669,True,Analisis Risk dan Return Investasi pada Ethereum dan Saham LQ45.pdf,2021,"https://scholar.google.com/scholar?hl=en&q=investasi&as_vis=1&as_sdt=1,5&start=%d&as_ylo=2018",Studi Ilmu Manajemen dan Organisasi,True,Scholar,"Chania, Mutia Fitri and Sara, Oyami and Sadalia, Isfenti"
Persepsi Dan Pengambilan Keputusan Milenial Terhadap Instumen Investasi Masa Depan: Studi Literatur,https://inobis.org/ojs/index.php/jurnal-inobis/article/view/129,10.35313/jrbi.v6i3.2235,True,Persepsi Dan Pengambilan Keputusan Milenial Terhadap Instumen Investasi Masa Depan_ Studi Literatur.pdf,2021,"https://scholar.google.com/scholar?hl=en&q=investasi&as_vis=1&as_sdt=1,5&start=%d&as_ylo=2018",Jurnal Riset Bisnis dan Investasi,True,Scholar,"Stevanus, Yosua and Rahadi, Dedi Rianto"
"Nilai Perusahaan Ditinjau Dari Tanggung Jawab Sosial, Tata Kelola, Dan Kesempatan Investasi Perusahaan",http://www.ojsapaji.org/index.php/apaji/article/view/17,10.35593/apaji.v2i2.17,True,Nilai Perusahaan Ditinjau Dari Tanggung Jawab Sosial_ Tata Kelola_ Dan Kesempatan Investasi Perusahaan.pdf,2020,"https://scholar.google.com/scholar?hl=en&q=investasi&as_vis=1&as_sdt=1,5&start=%d&as_ylo=2018",Accounting Profession Journal,True,Scholar,"Suryandari, Ni Nyoman Ayu and Mongan, Frischa Faradilla Arwinda"
"Analisis pengaruh kebijakan dividen, keputusan investasi dan keputusan pendanaan terhadap nilai perusahaan",https://ejournal.upi.edu/index.php/aset/article/view/16620/0,10.17509/jaset.v11i1.16620,True,Analisis pengaruh kebijakan dividen_ keputusan investasi dan keputusan pendanaan terhadap nilai perusahaan.pdf,2019,"https://scholar.google.com/scholar?hl=en&q=investasi&as_vis=1&as_sdt=1,5&start=%d&as_ylo=2018",Jurnal ASET (Akuntansi Riset),True,Scholar,"Piristina, Feny Alvita and Khairunnisa, Khairunnisa"
Mengeksplorasi Dampak Inovasi Teknologi Terbaru dalam Investasi Syariah,https://maryamsejahtera.com/index.php/Religion/article/view/830,,False,Mengeksplorasi Dampak Inovasi Teknologi Terbaru dalam Investasi Syariah.pdf,2023,"https://scholar.google.com/scholar?hl=en&q=investasi&as_vis=1&as_sdt=1,5&start=%d&as_ylo=2018",,True,Scholar,AI Hanafi;MA Firdaus
"Analisis perbandingan kinerja cryptocurrency bitcoin, saham, dan emas sebagai alternatif investasi",http://penerbitgoodwood.com/index.php/simo/article/view/393,10.23887/jimat.v14i04.53379,True,Analisis perbandingan kinerja cryptocurrency bitcoin_ saham_ dan emas sebagai alternatif investasi.pdf,2023,"https://scholar.google.com/scholar?hl=en&q=investasi&as_vis=1&as_sdt=1,5&start=%d&as_ylo=2018",JIMAT (Jurnal Ilmiah Mahasiswa Akuntansi) Undiksha,True,Scholar,"Ni Luh Ayu Setiawati and Diatmika, I Putu Gede"
Perspektif Pekerja Hotel Berbintang Di Destinasi Wisata Sanur Terhadap Literasi Investasi Saham Di Masa Pandemi Covid-19,https://publish.ojs-indonesia.com/index.php/SIWAYANG/article/view/50,10.54443/siwayang.v1i1.50,True,Perspektif Pekerja Hotel Berbintang Di Destinasi Wisata Sanur Terhadap Literasi Investasi Saham Di Masa Pandemi Covid-19.pdf,2022,"https://scholar.google.com/scholar?hl=en&q=investasi&as_vis=1&as_sdt=1,5&start=%d&as_ylo=2018","SIWAYANG JOURNAL: PUBLIKASI ILMIAH BIDANG PARIWISATA, KEBUDAYAAN, DAN ANTROPOLOGI",True,Scholar,"Made Darsana, I and Jayadi, Usman"
Kebijakan Moneter Terkini: Implikasi bagi Investasi dan Konsumsi Domestik,http://www.circle-archive.com/index.php/carc/article/view/188,,False,Kebijakan Moneter Terkini_ Implikasi bagi Investasi dan Konsumsi Domestik.pdf,2024,"https://scholar.google.com/scholar?hl=en&q=investasi&as_vis=1&as_sdt=1,5&start=%d&as_ylo=2018",,True,Scholar,C Matondang
Faktor-faktor yang mempengaruhi pengambilan keputusan investasi saham,http://ecojoin.org/index.php/EJE/article/view/669,10.52644/joeb.v13i1.1370,True,,2024,"https://scholar.google.com/scholar?hl=en&q=investasi&as_vis=1&as_sdt=1,5&start=%d&as_ylo=2018",Journal of Economics and Business UBS,False,,"Febrianti, Ervina and Bakhtiar, M. Rifki"
Pengaruh Pengetahuan Tentang Pasar Modal Syariah Terhadap Minat Investasi Saham di Pasar Modal Syariah,http://www.jurnaljipsya.org/index.php/jipsya/article/view/39,10.30596/ekonomikawan.v23i2.11034,True,,2023,"https://scholar.google.com/scholar?hl=en&q=investasi&as_vis=1&as_sdt=1,5&start=%d&as_ylo=2018",Ekonomikawan: Jurnal Ilmu Ekonomi dan Studi Pembangunan,False,,"Alfarauq, Adzkya Dzulda and Yusup, Deni Kamaludin"
"Keputusan Investasi Berdasarkan Literasi Keuangan, Pengetahuan Investasi dan Persepsi Risiko",https://www.jurnal.goretanpena.com/index.php/JSSR/article/view/1352,,False,Keputusan Investasi Berdasarkan Literasi Keuangan_ Pengetahuan Investasi dan Persepsi Risiko.pdf,2023,"https://scholar.google.com/scholar?hl=en&q=investasi&as_vis=1&as_sdt=1,5&start=%d&as_ylo=2018",,True,Scholar,
"Risiko Investasi Pada Tiga Jenis Investasi Yang Populer Di Indonesia (Saham, Reksadana, Dan Obligasi) Metode Value At Risk",http://tahtamedia.co.id/index.php/issj/article/view/671,,False,Risiko Investasi Pada Tiga Jenis Investasi Yang Populer Di Indonesia _Saham_ Reksadana_ Dan Obligasi_ Metode Value At Risk.pdf,2024,"https://scholar.google.com/scholar?hl=en&q=investasi&as_vis=1&as_sdt=1,5&start=%d&as_ylo=2018",,True,Scholar,R Firdaus;G Djuanda
Pengaruh investasi dan inflasi terhadap pertumbuhan ekonomi di kota makassar,https://jurnal.feb-umi.id/index.php/JER/article/view/460,10.31539/costing.v7i1.6407,True,Pengaruh investasi dan inflasi terhadap pertumbuhan ekonomi di kota makassar.pdf,2023,"https://scholar.google.com/scholar?hl=en&q=investasi&as_vis=1&as_sdt=1,5&start=%d&as_ylo=2018","Journal of Economic, Bussines and Accounting (COSTING)",True,Scholar,"Suprianto, Achmad Albar Permana and Primandhana, Wiwin Priana"
Analisis Konsep Investasi Dalam Islam,https://www.jurnal.staialhidayahbogor.ac.id/index.php/ad/article/view/3059,10.19109/wardah.v21i1.5822,True,Analisis Konsep Investasi Dalam Islam.pdf,2020,"https://scholar.google.com/scholar?hl=en&q=investasi&as_vis=1&as_sdt=1,5&start=%d&as_ylo=2018",Wardah,True,Scholar,"Binti Khalid, Ainor Syuhadah and Putri, Intan Delsa"
Perilaku Keuangan Berkelanjutan: Dampak Investasi Sosial dan Lingkungan,https://jurnal.syntax-idea.co.id/index.php/syntax-idea/article/view/2851,10.46799/syntax-idea.v5i12.2851,True,Perilaku Keuangan Berkelanjutan_ Dampak Investasi Sosial dan Lingkungan.pdf,2024,"https://scholar.google.com/scholar?hl=en&q=investasi&as_vis=1&as_sdt=1,5&start=%d&as_ylo=2018",Syntax Idea,True,Scholar,"Susanto, Eddy and Kadek Sirnawati, Ni"
Pengaruh Pengetahuan Investasi Di Pasar Modal Terhadap Minat Berinvestasi Mahasiswa,https://ijsr.internationaljournallabs.com/index.php/ijsr/article/view/51,10.55324/josr.v1i3.51,True,Pengaruh Pengetahuan Investasi Di Pasar Modal Terhadap Minat Berinvestasi Mahasiswa.pdf,2022,"https://scholar.google.com/scholar?hl=en&q=investasi&as_vis=1&as_sdt=1,5&start=%d&as_ylo=2018",Journal of Social Research,True,Scholar,"Syaputra, Andryan and Aslami, Nuri"
Perlindungan Hukum Terhadap Investor pada Investasi Illegal Secara Online dalam Perspektif Viktimologi,https://e-jurnal.lppmunsera.org/index.php/ajudikasi/article/view/4687,10.30656/ajudikasi.v6i2.4687,True,Perlindungan Hukum Terhadap Investor pada Investasi Illegal Secara Online dalam Perspektif Viktimologi.pdf,2022,"https://scholar.google.com/scholar?hl=en&q=investasi&as_vis=1&as_sdt=1,5&start=%d&as_ylo=2018",Ajudikasi : Jurnal Ilmu Hukum,True,Scholar,"Hermawanti, Kori and Sopiyanti, Intan Nuraini and Nufus, Hanifah Zakiyatun and Kuswandi, Kuswandi"
BUKU AJAR MANAJEMEN INVESTASI DAN PORTOFOLIO,http://tahtamedia.co.id/index.php/issj/article/download/406/402,,False,BUKU AJAR MANAJEMEN INVESTASI DAN PORTOFOLIO.pdf,2023,"https://scholar.google.com/scholar?hl=en&q=investasi&as_vis=1&as_sdt=1,5&start=%d&as_ylo=2018",,True,Scholar,AP Aslam
Waspada Investasi Ilegal di Indonesia,https://ejournal.bsi.ac.id/ejurnal/index.php/perspektif/article/view/12518,10.31294/jp.v20i1.12518,True,Waspada Investasi Ilegal di Indonesia.pdf,2022,"https://scholar.google.com/scholar?hl=en&q=investasi&as_vis=1&as_sdt=1,5&start=%d&as_ylo=2018",Jurnal Perspektif,True,Scholar,"Tambunan, Diana and Hendarsih, Ida"
Pengenalan Dasar-Dasar Investasi Pada Guru-Guru Madrasah Al-Quba,https://stp-mataram.e-journal.id/Amal/article/view/886,,False,Pengenalan Dasar-Dasar Investasi Pada Guru-Guru Madrasah Al-Quba.pdf,2021,"https://scholar.google.com/scholar?hl=en&q=investasi&as_vis=1&as_sdt=1,5&start=%d&as_ylo=2018",,True,Scholar,
"Pengaruh Keputusan Investasi, Keputusan Pendanaan, Kebijakan Deviden, Profitabilitas, dan Ukuran Dewan Komisaris Terhadap Nilai Perusahaan",http://repository.urecol.org/index.php/proceeding/article/view/2327,10.33197/bes.vol2.iss2.2022.1814,True,Pengaruh Keputusan Investasi_ Keputusan Pendanaan_ Kebijakan Deviden_ Profitabilitas_ dan Ukuran Dewan Komisaris Terhadap Nilai Perusahaan.pdf,2024,"https://scholar.google.com/scholar?hl=en&q=investasi&as_vis=1&as_sdt=1,5&start=%d&as_ylo=2018","Jurnal Bisnis, Ekonomi, dan Sains",True,Scholar,"Sarumpaet, Tetty Lasniroha and Rahmanda, Violeta"
Determinasi Faktor-Faktor Mempengaruhi Keputusan Investasi Investor Pemula Dengan Dimoderasi Risk Tolerance,https://www.journal.lppmpelitabangsa.id/index.php/akubis/article/view/852,,False,Determinasi Faktor-Faktor Mempengaruhi Keputusan Investasi Investor Pemula Dengan Dimoderasi Risk Tolerance.pdf,2023,"https://scholar.google.com/scholar?hl=en&q=investasi&as_vis=1&as_sdt=1,5&start=%d&as_ylo=2018",,True,Scholar,
